{
  "$schema": "http://json-schema.org/draft-07/schema#",
  "$id": "https://smart-office.local/schemas/n8n-official-ops-override.schema.json",
  "title": "N8nOfficialOperationsOverride",
  "type": "object",
  "additionalProperties": false,
  "properties": {
    "provider": { "type": "string", "pattern": "^[a-z0-9-]+$" },
    "nodeType": { "type": "string", "minLength": 1 },
    "sourceDocs": {
      "type": "array",
      "items": { "type": "string", "minLength": 1 },
      "uniqueItems": true
    },
    "resources": {
      "type": "object",
      "additionalProperties": false,
      "patternProperties": {
        "^[a-zA-Z0-9_-]+$": {
          "type": "object",
          "additionalProperties": false,
          "properties": {
            "operations": {
              "type": "object",
              "additionalProperties": false,
              "patternProperties": {
                "^[a-zA-Z0-9_-]+$": {
                  "type": "object",
                  "additionalProperties": false,
                  "properties": {
                    "description": { "type": "string" },
                    "params": {
                      "type": "object",
                      "additionalProperties": false,
                      "properties": {
                        "required": {
                          "type": "array",
                          "items": { "type": "string", "minLength": 1 },
                          "uniqueItems": true
                        },
                        "optional": {
                          "type": "array",
                          "items": { "type": "string", "minLength": 1 },
                          "uniqueItems": true
                        }
                      }
                    },
                    "returns": {
                      "type": "object",
                      "additionalProperties": false,
                      "properties": {
                        "data": {
                          "type": "array",
                          "items": { "type": "string", "minLength": 1 },
                          "uniqueItems": true
                        },
                        "binary": {
                          "type": "array",
                          "items": { "type": "string", "minLength": 1 },
                          "uniqueItems": true
                        },
                        "notes": {
                          "type": "array",
                          "items": { "type": "string", "minLength": 1 }
                        }
                      }
                    },
                    "notes": {
                      "type": "array",
                      "items": { "type": "string", "minLength": 1 }
                    }
                  }
                }
              }
            }
          }
        }
      }
    }
  }
}
