{
  "provider": "openai",
  "nodeType": "n8n-nodes-langchain.openai",
  "resources": {
    "text": {
      "operations": {
        "classifyTextForViolations": {
          "params": {
            "required": [
              "text"
            ],
            "optional": []
          },
          "returns": {
            "data": [
              "classification"
            ],
            "binary": []
          }
        },
        "generateModelResponse": {
          "params": {
            "required": [
              "text"
            ],
            "optional": []
          },
          "returns": {
            "data": [
              "response"
            ],
            "binary": []
          }
        },
        "generateChatCompletion": {
          "params": {
            "required": [
              "text"
            ],
            "optional": []
          },
          "returns": {
            "data": [
              "completion"
            ],
            "binary": []
          }
        }
      }
    }
  },
  "sourceDocs": [
    "docs/n8n/html/openai.html"
  ]
}
