{
  "provider": "google-docs",
  "nodeType": "n8n-nodes-base.googleDocs",
  "resources": {
    "document": {
      "operations": {
        "create": {
          "params": {
            "required": [
              "title"
            ],
            "optional": [
              "folderId"
            ]
          },
          "returns": {
            "data": [
              "documentId",
              "title"
            ],
            "binary": []
          }
        },
        "get": {
          "params": {
            "required": [
              "documentId"
            ],
            "optional": []
          },
          "returns": {
            "data": [
              "body",
              "documentId",
              "title"
            ],
            "binary": []
          }
        },
        "update": {
          "params": {
            "required": [
              "documentId"
            ],
            "optional": [
              "html",
              "requests",
              "text"
            ]
          },
          "returns": {
            "data": [
              "documentId"
            ],
            "binary": []
          }
        }
      }
    }
  },
  "sourceDocs": [
    "docs/n8n/raw/google-docs.md"
  ]
}
