{
  "provider": "axonaut",
  "nodeType": "n8n-nodes-base.axonaut",
  "resources": {
    "company": {
      "operations": {
        "update": {
          "params": {
            "required": [
              "company"
            ],
            "optional": []
          },
          "returns": {
            "data": [
              "company_id"
            ],
            "binary": []
          }
        }
      }
    },
    "contact": {
      "operations": {
        "create": {
          "params": {
            "required": [
              "contact"
            ],
            "optional": []
          },
          "returns": {
            "data": [
              "contact_id"
            ],
            "binary": []
          },
          "description": "Cree un contact dans Axonaut"
        }
      }
    }
  },
  "sourceDocs": [
    "docs/n8n/raw/axonaut.md"
  ]
}
