{
  "provider": "brevo",
  "nodeType": "n8n-nodes-base.brevo",
  "resources": {
    "campaign": {
      "operations": {
        "createCampaign": {
          "params": {
            "required": [
              "content",
              "name"
            ],
            "optional": []
          },
          "returns": {
            "data": [
              "campaign_id"
            ],
            "binary": []
          }
        }
      }
    },
    "email": {
      "operations": {
        "sendEmail": {
          "params": {
            "required": [
              "body",
              "subject",
              "to"
            ],
            "optional": [
              "attachments"
            ]
          },
          "returns": {
            "data": [
              "message_id"
            ],
            "binary": []
          }
        }
      }
    }
  },
  "sourceDocs": [
    "docs/n8n/raw/brevo.md"
  ]
}
