{
  "provider": "google-calendar",
  "nodeType": "n8n-nodes-base.googleCalendar",
  "resources": {
    "event": {
      "operations": {
        "create": {
          "params": {
            "required": [
              "end",
              "start",
              "title"
            ],
            "optional": [
              "attendees",
              "description"
            ]
          },
          "returns": {
            "data": [
              "eventId",
              "htmlLink"
            ],
            "binary": []
          }
        },
        "getMany": {
          "params": {
            "required": [],
            "optional": [
              "limit",
              "timeMax",
              "timeMin"
            ]
          },
          "returns": {
            "data": [
              "events",
              "nextPageToken"
            ],
            "binary": []
          }
        }
      }
    }
  },
  "sourceDocs": [
    "docs/n8n/raw/google-calendar.md"
  ]
}
